{
  "$schema": "../schemas/scenario.schema.json",
  "id": "overqualified-part-time-job",
  "title": {
    "ja": "バイト面接の超人的経歴",
    "en": "An Overqualified Part-Time Applicant",
    "zh": "超規格的打工應徵者"
  },
  "description": {
    "ja": "国家級の経歴を持つ人物がバイト面接に現れる誇張から、職務との落差を具体的に拾う練習です。",
    "en": "Practice targeting the mismatch between nation-scale credentials and an ordinary part-time job.",
    "zh": "練習具體抓出國家級資歷與一般打工職務之間的落差。"
  },
  "evaluationAxes": [
    {
      "id": "status-mismatch",
      "label": {
        "ja": "立場の落差",
        "en": "Role mismatch",
        "zh": "身分落差"
      },
      "description": {
        "ja": "国家級の経歴とバイト業務の落差を捉える",
        "en": "Identify the gap between nation-scale credentials and part-time work.",
        "zh": "抓住國家級資歷與打工職務之間的落差。"
      },
      "maxPoints": 30
    },
    {
      "id": "detail-targeting",
      "label": {
        "ja": "具体点",
        "en": "Detail targeting",
        "zh": "具體切入"
      },
      "description": {
        "ja": "履歴書、推薦人、業務など場面の具体点を拾う",
        "en": "Target a concrete detail such as the résumé, references, or duties.",
        "zh": "抓住履歷、推薦人或工作內容等具體細節。"
      },
      "maxPoints": 20
    },
    {
      "id": "clarity",
      "label": {
        "ja": "明瞭さ",
        "en": "Clarity",
        "zh": "清晰度"
      },
      "description": {
        "ja": "短く分かりやすく伝える",
        "en": "Communicate briefly and clearly.",
        "zh": "簡短清楚地表達。"
      },
      "maxPoints": 15
    },
    {
      "id": "word-choice",
      "label": {
        "ja": "言葉選び",
        "en": "Word choice",
        "zh": "措辭"
      },
      "description": {
        "ja": "場面に合う勢いと言葉を選ぶ",
        "en": "Choose language and energy suited to the moment.",
        "zh": "選擇符合情境的措辭與力度。"
      },
      "maxPoints": 15
    }
  ],
  "beats": [
    {
      "id": "opening",
      "boke": {
        "ja": "バイトに応募したんやけど、前職は三つの国をまとめる仕事やってん。",
        "en": "I applied to be a store clerk; my last job was uniting three countries.",
        "zh": "我來應徵店員，上一份工作是統一三個國家。"
      },
      "reaction": {
        "description": {
          "ja": "国家級の経歴を面接で誇らしげに語る",
          "en": "Boast about nation-scale credentials in a part-time interview",
          "zh": "在打工面試中得意地談論國家級資歷"
        },
        "motionTags": [
          "pose:talking_02",
          "category:talking"
        ],
        "variant": 0,
        "priority": 1,
        "cue": "start"
      },
      "choices": [
        {
          "id": "opening-strong",
          "text": {
            "ja": "三か国まとめた人が、なんでバイトの面接来てんねん！",
            "en": "You united three countries—why are you interviewing for a part-time job?",
            "zh": "都統一三個國家了，怎麼會來面試打工啦！"
          },
          "axisScores": {
            "status-mismatch": 30,
            "detail-targeting": 20,
            "clarity": 15,
            "word-choice": 15
          },
          "feedback": {
            "ja": "国家級の実績とバイト面接の落差を直接結び付け、誇張の核心を明確に示しています。",
            "en": "This directly connects the nation-scale achievement to the part-time interview and exposes the central mismatch.",
            "zh": "直接連結國家級成就與打工面試，清楚點出核心落差。"
          }
        },
        {
          "id": "opening-partial",
          "text": {
            "ja": "前職の規模が履歴書に収まらへんわ！",
            "en": "That last job won't even fit on a résumé!",
            "zh": "你上一份工作的規模，履歷根本寫不下啦！"
          },
          "axisScores": {
            "status-mismatch": 18,
            "detail-targeting": 16,
            "clarity": 14,
            "word-choice": 12
          },
          "feedback": {
            "ja": "経歴の大きさは具体的に拾えていますが、バイトとの立場の落差までは示していません。",
            "en": "This targets the scale of the résumé, but it does not fully expose the mismatch with the part-time role.",
            "zh": "具體抓到履歷規模過大，但還沒有完整指出它與打工職務的落差。"
          }
        },
        {
          "id": "opening-weak",
          "text": {
            "ja": "国際経験が豊富ですね。",
            "en": "You certainly have a lot of international experience.",
            "zh": "你的國際經驗很豐富呢。"
          },
          "axisScores": {
            "status-mismatch": 2,
            "detail-targeting": 4,
            "clarity": 14,
            "word-choice": 4
          },
          "feedback": {
            "ja": "言葉は明瞭ですが、国家級の経歴を普通の職歴として受け入れ、バイトとの落差を逃しています。",
            "en": "The wording is clear, but it treats the nation-scale claim as ordinary experience and misses the job mismatch.",
            "zh": "表達清楚，但把國家級經歷當成一般資歷，錯過了與打工職務的落差。"
          }
        }
      ]
    },
    {
      "id": "clarify",
      "boke": {
        "ja": "履歴書の代わりに国連決議を持ってきたで。推薦人は三か国の大統領や。",
        "en": "I brought a UN resolution instead of a résumé. Three presidents are my references.",
        "zh": "我用聯合國決議代替履歷，推薦人是三國總統。"
      },
      "reaction": {
        "description": {
          "ja": "国連決議と大統領推薦を履歴書代わりに差し出す",
          "en": "Offer a UN resolution and presidential references as a résumé",
          "zh": "拿聯合國決議與總統推薦人代替履歷"
        },
        "motionTags": [
          "pose:talking_03",
          "category:talking"
        ],
        "variant": 1,
        "priority": 1,
        "cue": "start"
      },
      "choices": [
        {
          "id": "clarify-strong",
          "text": {
            "ja": "履歴書の代わりに国連決議出す人おらんわ！",
            "en": "No one submits a UN resolution instead of a résumé!",
            "zh": "哪有人拿聯合國決議代替履歷啦！"
          },
          "axisScores": {
            "status-mismatch": 30,
            "detail-targeting": 20,
            "clarity": 15,
            "word-choice": 15
          },
          "feedback": {
            "ja": "国連決議と履歴書の用途の違いを名指しし、面接との落差を一言で示しています。",
            "en": "This names the mismatch between a UN resolution and a résumé, keeping the interview premise in focus.",
            "zh": "點明聯合國決議與履歷用途不同，一句話就抓住面試情境的落差。"
          }
        },
        {
          "id": "clarify-partial",
          "text": {
            "ja": "推薦人が大物すぎて電話確認できへんわ！",
            "en": "Those references are too important for a routine phone check!",
            "zh": "推薦人太大咖，電話查核都做不了啦！"
          },
          "axisScores": {
            "status-mismatch": 17,
            "detail-targeting": 18,
            "clarity": 14,
            "word-choice": 12
          },
          "feedback": {
            "ja": "大統領という具体点を拾えていますが、国連決議を履歴書にする核心には届いていません。",
            "en": "This uses the presidential references, but it misses the central résumé-versus-resolution contradiction.",
            "zh": "抓到總統推薦人的細節，但沒有擊中用聯合國決議代替履歷的核心矛盾。"
          }
        },
        {
          "id": "clarify-weak",
          "text": {
            "ja": "推薦人まで豪華ですね。",
            "en": "Those are some impressive references.",
            "zh": "連推薦人都很豪華呢。"
          },
          "axisScores": {
            "status-mismatch": 2,
            "detail-targeting": 4,
            "clarity": 14,
            "word-choice": 3
          },
          "feedback": {
            "ja": "推薦人を褒めるだけでは、履歴書の代わりが国連決議という異常さを肯定してしまいます。",
            "en": "Praising the references accepts the absurd substitution of a UN resolution for a résumé.",
            "zh": "只稱讚推薦人，等於接受用聯合國決議代替履歷的荒謬設定。"
          }
        }
      ]
    },
    {
      "id": "constructive-close",
      "boke": {
        "ja": "でもレジ経験はないから、まず世界平和より品出しを覚えるわ。",
        "en": "I have no register experience, so I'll learn stocking shelves before world peace.",
        "zh": "但我沒用過收銀機，所以先學補貨再談世界和平。"
      },
      "reaction": {
        "description": {
          "ja": "品出しと世界平和を同じ優先順位で比べる",
          "en": "Compare stocking shelves with achieving world peace",
          "zh": "把補貨與世界和平放在同一個優先順序比較"
        },
        "motionTags": [
          "pose:emotion_04",
          "category:talking"
        ],
        "variant": 2,
        "priority": 1,
        "cue": "start"
      },
      "choices": [
        {
          "id": "constructive-close-strong",
          "text": {
            "ja": "品出しと世界平和を同じ研修表に並べるな！",
            "en": "Don't put stocking shelves and world peace on the same training plan!",
            "zh": "別把補貨和世界和平排在同一張訓練表上啦！"
          },
          "axisScores": {
            "status-mismatch": 30,
            "detail-targeting": 20,
            "clarity": 15,
            "word-choice": 15
          },
          "feedback": {
            "ja": "品出しと世界平和を同列にした落差を具体的に示し、締めの誇張を明確に回収しています。",
            "en": "This explicitly contrasts stocking shelves with world peace and cleanly resolves the final exaggeration.",
            "zh": "具體對比補貨與世界和平，清楚收回最後的誇張笑點。"
          }
        },
        {
          "id": "constructive-close-partial",
          "text": {
            "ja": "まずレジ打ちから覚えよか！",
            "en": "Let's start with the register, at least!",
            "zh": "至少先從收銀機學起吧！"
          },
          "axisScores": {
            "status-mismatch": 12,
            "detail-targeting": 13,
            "clarity": 15,
            "word-choice": 8
          },
          "feedback": {
            "ja": "現実的な業務へ戻せていますが、世界平和との途方もない落差を言葉にしていません。",
            "en": "This redirects to a realistic duty, but it does not name the enormous contrast with world peace.",
            "zh": "把話題拉回實際工作，但沒有說出它與世界和平之間的巨大落差。"
          }
        },
        {
          "id": "constructive-close-weak",
          "text": {
            "ja": "世界平和のあとに品出し頼むわ。",
            "en": "Handle world peace first, then stock the shelves.",
            "zh": "先處理世界和平，再來補貨吧。"
          },
          "axisScores": {
            "status-mismatch": 4,
            "detail-targeting": 6,
            "clarity": 14,
            "word-choice": 6
          },
          "feedback": {
            "ja": "順番を付けるだけでは二つを同列に扱う前提を受け入れています。落差そのものを否定しましょう。",
            "en": "Putting the tasks in order accepts that they belong on the same list. Reject the mismatch itself.",
            "zh": "只安排順序仍接受兩件事能並列的前提，應直接否定這個落差。"
          }
        }
      ]
    }
  ]
}
