{
  "$schema": "../schemas/scenario.schema.json",
  "id": "anxious-about-test-results",
  "title": {
    "ja": "検査結果を待つ不安",
    "en": "Anxious About Test Results",
    "zh": "等待檢查結果的焦慮"
  },
  "description": {
    "ja": "医療コミュニケーションとして「検査結果を待つ不安」に対応し、状況に合う短い応答を選ぶ練習です。",
    "en": "Practice concise, context-appropriate responses in “Anxious About Test Results” for Clinical Communication.",
    "zh": "在「等待檢查結果的焦慮」中練習符合情境的簡短醫療溝通回應。"
  },
  "evaluationAxes": [
    {
      "id": "empathy",
      "label": {
        "ja": "共感",
        "en": "Empathy",
        "zh": "同理心"
      },
      "description": {
        "ja": "相手の感情や負担を受け止める",
        "en": "Acknowledge the other person's feelings or burden.",
        "zh": "接住對方的感受或負擔。"
      },
      "maxPoints": 20
    },
    {
      "id": "plain-language",
      "label": {
        "ja": "平易な説明",
        "en": "Plain language",
        "zh": "淺白說明"
      },
      "description": {
        "ja": "専門用語を避け理解を確認する",
        "en": "Avoid jargon and check understanding.",
        "zh": "避免術語並確認理解。"
      },
      "maxPoints": 20
    },
    {
      "id": "fact-checking",
      "label": {
        "ja": "事実確認",
        "en": "Fact checking",
        "zh": "事實確認"
      },
      "description": {
        "ja": "推測せず必要な事実を確認する",
        "en": "Verify necessary facts instead of guessing.",
        "zh": "不憑猜測，確認必要事實。"
      },
      "maxPoints": 20
    },
    {
      "id": "boundary-keeping",
      "label": {
        "ja": "境界維持",
        "en": "Boundary keeping",
        "zh": "界線維持"
      },
      "description": {
        "ja": "権限外の断定や約束を避ける",
        "en": "Avoid unsupported claims or commitments.",
        "zh": "避免超出權限的斷言或承諾。"
      },
      "maxPoints": 20
    }
  ],
  "beats": [
    {
      "id": "opening",
      "boke": {
        "ja": "結果を待つ間に悪いことばかり考えてしまいます。大丈夫でしょうか。",
        "en": "While waiting for the results, I keep imagining the worst. Will I be okay?",
        "zh": "等待結果時我一直往壞處想，真的會沒事嗎？"
      },
      "reaction": {
        "description": {
          "ja": "率直に問題を切り出す",
          "en": "Raise the issue candidly",
          "zh": "坦率提出問題"
        },
        "motionTags": [
          "pose:talking_02",
          "category:talking"
        ],
        "variant": 0,
        "priority": 1,
        "cue": "start"
      },
      "choices": [
        {
          "id": "opening-strong",
          "text": {
            "ja": "不安やつらさを受け止め、今分かっていることを平易に説明します。",
            "en": "I will acknowledge the anxiety and explain what is currently known in plain language.",
            "zh": "我會接住焦慮與不適，用淺白語言說明目前已知事項。"
          },
          "axisScores": {
            "empathy": 20,
            "plain-language": 20,
            "fact-checking": 20,
            "boundary-keeping": 20
          },
          "feedback": {
            "ja": "相手の要点を受け止め、確認と次の行動を短く結び付けた応答です。",
            "en": "This response acknowledges the key point and links verification to a clear next action.",
            "zh": "這個回應接住重點，並把確認與明確的下一步連結起來。"
          }
        },
        {
          "id": "opening-partial",
          "text": {
            "ja": "分かりました。少し考えさせてください。",
            "en": "I understand. Let me think about it.",
            "zh": "我明白了，請讓我想一下。"
          },
          "axisScores": {
            "empathy": 13,
            "plain-language": 11,
            "fact-checking": 12,
            "boundary-keeping": 12
          },
          "feedback": {
            "ja": "対話は保てますが、確認事項か次の行動を具体化するとさらに有効です。",
            "en": "This keeps the dialogue open, but it should specify either what to verify or what happens next.",
            "zh": "這能維持對話，但若能具體說明要確認什麼或下一步會更有效。"
          }
        },
        {
          "id": "opening-weak",
          "text": {
            "ja": "それは私の問題ではありません。",
            "en": "That is not my problem.",
            "zh": "那不是我的問題。"
          },
          "axisScores": {
            "empathy": 2,
            "plain-language": 3,
            "fact-checking": 2,
            "boundary-keeping": 3
          },
          "feedback": {
            "ja": "相手の要点を退けるだけでは情報と信頼を失います。断定せず、まず確認しましょう。",
            "en": "Dismissing the issue loses information and trust. Avoid assumptions and verify first.",
            "zh": "只是否定問題會失去資訊與信任；應避免武斷並先確認。"
          }
        }
      ]
    },
    {
      "id": "clarify",
      "boke": {
        "ja": "まだ大切な点が伝わっていない気がします。何を確認しますか。",
        "en": "I don't think the key point is clear yet. What will you check?",
        "zh": "我覺得重點還沒說清楚。你要確認什麼？"
      },
      "reaction": {
        "description": {
          "ja": "説明や確認を求める",
          "en": "Ask for clarification",
          "zh": "要求說明與確認"
        },
        "motionTags": [
          "pose:talking_03",
          "category:talking"
        ],
        "variant": 1,
        "priority": 1,
        "cue": "start"
      },
      "choices": [
        {
          "id": "clarify-strong",
          "text": {
            "ja": "診断を急がず、理解と疑問を確認して必要な専門判断につなぎます。",
            "en": "I will not rush to a diagnosis; I will check understanding and connect to appropriate clinical judgment.",
            "zh": "我不急著診斷，會確認理解與疑問並交由適當專業判斷。"
          },
          "axisScores": {
            "empathy": 20,
            "plain-language": 20,
            "fact-checking": 20,
            "boundary-keeping": 20
          },
          "feedback": {
            "ja": "相手の要点を受け止め、確認と次の行動を短く結び付けた応答です。",
            "en": "This response acknowledges the key point and links verification to a clear next action.",
            "zh": "這個回應接住重點，並把確認與明確的下一步連結起來。"
          }
        },
        {
          "id": "clarify-partial",
          "text": {
            "ja": "分かりました。少し考えさせてください。",
            "en": "I understand. Let me think about it.",
            "zh": "我明白了，請讓我想一下。"
          },
          "axisScores": {
            "empathy": 13,
            "plain-language": 11,
            "fact-checking": 12,
            "boundary-keeping": 12
          },
          "feedback": {
            "ja": "対話は保てますが、確認事項か次の行動を具体化するとさらに有効です。",
            "en": "This keeps the dialogue open, but it should specify either what to verify or what happens next.",
            "zh": "這能維持對話，但若能具體說明要確認什麼或下一步會更有效。"
          }
        },
        {
          "id": "clarify-weak",
          "text": {
            "ja": "それは私の問題ではありません。",
            "en": "That is not my problem.",
            "zh": "那不是我的問題。"
          },
          "axisScores": {
            "empathy": 2,
            "plain-language": 3,
            "fact-checking": 2,
            "boundary-keeping": 3
          },
          "feedback": {
            "ja": "相手の要点を退けるだけでは情報と信頼を失います。断定せず、まず確認しましょう。",
            "en": "Dismissing the issue loses information and trust. Avoid assumptions and verify first.",
            "zh": "只是否定問題會失去資訊與信任；應避免武斷並先確認。"
          }
        }
      ]
    },
    {
      "id": "constructive-close",
      "boke": {
        "ja": "分かりました。では、次にどう進めるか具体的に決められますか。",
        "en": "Understood. Can we decide specifically what happens next?",
        "zh": "了解。那麼可以具體決定下一步嗎？"
      },
      "reaction": {
        "description": {
          "ja": "次の行動を確かめる",
          "en": "Confirm the next action",
          "zh": "確認下一步行動"
        },
        "motionTags": [
          "pose:emotion_04",
          "category:talking"
        ],
        "variant": 2,
        "priority": 1,
        "cue": "start"
      },
      "choices": [
        {
          "id": "constructive-close-strong",
          "text": {
            "ja": "一般的な情報と個別判断を区別し、次の確認方法を示します。",
            "en": "I will distinguish general information from individual advice and explain the next check.",
            "zh": "我會區分一般資訊與個別判斷，並說明下一步確認方式。"
          },
          "axisScores": {
            "empathy": 20,
            "plain-language": 20,
            "fact-checking": 20,
            "boundary-keeping": 20
          },
          "feedback": {
            "ja": "相手の要点を受け止め、確認と次の行動を短く結び付けた応答です。",
            "en": "This response acknowledges the key point and links verification to a clear next action.",
            "zh": "這個回應接住重點，並把確認與明確的下一步連結起來。"
          }
        },
        {
          "id": "constructive-close-partial",
          "text": {
            "ja": "分かりました。少し考えさせてください。",
            "en": "I understand. Let me think about it.",
            "zh": "我明白了，請讓我想一下。"
          },
          "axisScores": {
            "empathy": 13,
            "plain-language": 11,
            "fact-checking": 12,
            "boundary-keeping": 12
          },
          "feedback": {
            "ja": "対話は保てますが、確認事項か次の行動を具体化するとさらに有効です。",
            "en": "This keeps the dialogue open, but it should specify either what to verify or what happens next.",
            "zh": "這能維持對話，但若能具體說明要確認什麼或下一步會更有效。"
          }
        },
        {
          "id": "constructive-close-weak",
          "text": {
            "ja": "それは私の問題ではありません。",
            "en": "That is not my problem.",
            "zh": "那不是我的問題。"
          },
          "axisScores": {
            "empathy": 2,
            "plain-language": 3,
            "fact-checking": 2,
            "boundary-keeping": 3
          },
          "feedback": {
            "ja": "相手の要点を退けるだけでは情報と信頼を失います。断定せず、まず確認しましょう。",
            "en": "Dismissing the issue loses information and trust. Avoid assumptions and verify first.",
            "zh": "只是否定問題會失去資訊與信任；應避免武斷並先確認。"
          }
        }
      ]
    }
  ]
}
